Review Text,Rating,Date,Location,Reviewer ID,Sentiment Polarity,Category
"Sharing so much with Swiggy after leaving such hard paper trail makes no sense. Buy a used car, Swiss watch, gold, diamond or any expensive thing using that cash. Trade it in to get money in the bank.",2,2024-11-17 12:19:17,"Delhi, India",GutsyGoofy,Negative,Overall Experience
Plot twist: Swiggy becomes your business partner and starts upselling your ‘invisible gourmet meals’ as their premium ghost kitchen service.,3,2024-11-17 12:21:56,"Mumbai, India",cocain4kids,Neutral,Pricing
I aint a ca but there are surely better ways to cover 10 lacs up,5,2024-11-17 13:08:42,"Mumbai, India",Economy-Lychee-2284,Positive,Overall Experience
Yea easy way to loose 40% to zomato.,5,2024-11-17 11:51:26,"Mumbai, India",Zestyclose_Mud2170,Positive,Delivery Speed
"Sorry to say, this doesn't explain how listing one dish publicly in a menu will allow money laundering...

Edit: The restaurant will pay 20% of money on orders of this dish to Swiggy.",2,2024-11-17 10:40:01,"Chennai, India",babathepower,Negative,Pricing
nice watch. thanks for sharing.,5,2024-11-17 12:38:06,"Chennai, India",Critical_Active2238,Positive,Pricing
Wallet Address: bc1qmwa6l4j0sywwtnd7hc9x2arsc7lq8ddmrm60w2,3,2024-11-17 12:10:09,"Bangalore, India",torinotor,Neutral,Customer Service
"Crazy bro, but how do they register a restaurant on Swiggy? What documents are they using for GST and all ?",2,2024-11-17 19:46:34,"Chennai, India",The_Indian_News,Negative,Food Quality
"I’m open for crowdfunding! Sharing my BTC wallet address
bc1qmwa6l4j0sywwtnd7hc9x2arsc7lq8ddmrm60w2",3,2024-11-17 12:10:58,"Mumbai, India",torinotor,Neutral,Customer Service
_bonks_,3,2024-11-17 15:16:29,"Mumbai, India",a_rousedpanda,Neutral,Pricing
Unfortunately I can't update the post for some reason,2,2024-11-18 07:44:27,"Hyderabad, India",torinotor,Negative,Pricing
https://preview.redd.it/bp6jqnvfxn1e1.jpeg?width=1284&format=pjpg&auto=webp&s=c7819822e7a14b11a2c03e7b5e60384b6dc7a16c,3,2024-11-18 13:34:05,"Hyderabad, India",Tricky-Candidate-970,Neutral,Food Quality
Amrit Kal,3,2024-11-18 11:42:04,"Chennai, India",kappa23,Neutral,Overall Experience
Bro .. this is money laundering 101... Everyone knows this information,3,2024-11-17 18:12:16,"Hyderabad, India",Silent_Spinach_3692,Neutral,Customer Service
You're losing 20-30% on each transaction as commission to the platform needlessly,2,2024-11-18 03:33:19,"Mumbai, India",MrEthelWulf,Negative,Overall Experience
Aren't they too cheap then?,5,2024-11-19 03:53:02,"Bangalore, India",Comprehensive_Eye991,Positive,Pricing
"I'm agreeing to the theory of drugs, I'm trying to figure the thought or process of how this front works",3,2024-11-17 13:26:56,"Delhi, India",whatyouthinkisfake,Neutral,Customer Service
isn't that about as bad as paying income tax on the income in the first place? Why even bother?,2,2024-11-17 11:34:22,"Delhi, India",thequickbrownbear,Negative,Pricing
Don't accept everyone's order,3,2024-11-17 16:54:34,"Chennai, India",chatgptbotindia,Neutral,Food Quality
"OP placed an order, the order was canceled",3,2024-11-17 17:45:42,"Chennai, India",random0024_,Neutral,Customer Service
One order can contain multiple quantity of item so number of order might be less than 666.,2,2024-11-17 15:56:14,"Mumbai, India",UjraChaman,Negative,Food Quality
"Twist... What if Swiggy using it to show boost of revenue. Win Win for both.
😂",5,2024-11-17 15:56:20,"Hyderabad, India",Strange_Evidence1281,Positive,Overall Experience
Damn is creating a wallet that quick?!,5,2024-11-17 13:09:42,"Hyderabad, India",lord_chihuahua,Positive,Pricing
"i'm intrigued, let's see what you get out of this",3,2024-11-17 12:23:03,"Mumbai, India",PM_ME_YOUR_PYAAR,Neutral,Food Quality
Hey how do u make one!,3,2024-11-17 14:04:54,"Mumbai, India",fatasfnigha,Neutral,Customer Service
"To open a cloud kitchen, you don't need GST. You just need a licence from FSSAI.",3,2024-11-21 05:10:59,"Hyderabad, India",samay_china,Neutral,Delivery Speed
That’s crazy bro 👏,2,2024-11-18 17:38:15,"Mumbai, India",Pale_Ad5681,Negative,Food Quality
Nah everyone things unexplainable money thing = money laundering,3,2024-11-21 09:16:15,"Hyderabad, India",Ok-Signal5243,Neutral,Delivery Speed
unless dipgoy is doing it,3,2024-11-18 04:25:51,"Chennai, India",bhukkhad,Neutral,Food Quality
Plus you'll need multiple addresses/people to get it delivered to otherwise it'll just raise suspicions,3,2024-11-18 07:01:15,"Delhi, India",kaladin_stormchest,Neutral,Food Quality
"But how would you explain the 10 lakhs for payment of IT, guy already mentioned that such money is obtained illegally",2,2024-11-17 11:42:33,"Hyderabad, India",rohitnair87,Negative,Customer Service
You need to pay taxes on the 1000 as that’s the income technically,3,2024-11-17 17:57:01,"Chennai, India",pm_mba,Neutral,Pricing
"https://preview.redd.it/s2l8i3ls1h1e1.jpeg?width=1284&format=pjpg&auto=webp&s=8c9f8a2578661ec08cb1a498a80ca5923545c47a

So the order eventually got rejected and I was issued a refund 🤔",3,2024-11-17 14:26:15,"Mumbai, India",torinotor,Neutral,Food Quality
Spread the news :),5,2024-11-17 13:25:35,"Delhi, India",ranker2241,Positive,Customer Service
https://x.com/nitish_an/status/1858411940755993002?s=46,3,2024-11-18 08:16:18,"Bangalore, India",torinotor,Neutral,Pricing
"I mean, there are thousand other ways to do this at a far lesser rate.",2,2024-11-17 16:23:12,"Bangalore, India",ManagementSignal9176,Negative,Overall Experience
"Ah but that's the fun part, you don't! 

Operating expenses, capital expenses etc = Rs.990

You pay tax on 10 rupees",5,2024-11-18 04:25:21,"Delhi, India",risheeb1002,Positive,Food Quality
"Looool
Thats the least exciting outcome😭🤣 maybe they only ""serve"" their products late at night


OP did his part tho, respect",2,2024-11-17 14:28:06,"Mumbai, India",ranker2241,Negative,Delivery Speed
"Also, the restaurant is not accepting orders anymore

https://preview.redd.it/gaw7wo922h1e1.jpeg?width=1284&format=pjpg&auto=webp&s=9690818b16487eb625fbf07c97797286d0882b9f",3,2024-11-17 14:27:33,"Mumbai, India",torinotor,Neutral,Customer Service
https://x.com/nitish_an/status/1858411940755993002?s=46,3,2024-11-18 08:16:40,"Mumbai, India",torinotor,Neutral,Customer Service
"Lol, maybe you blew their cover, their fleeing town right now",5,2024-11-17 16:09:53,"Mumbai, India",ranker2241,Positive,Food Quality
maybe you have to contact them before you order to get what they are actually delivering...,3,2024-11-17 16:47:23,"Chennai, India",Area_Ok,Neutral,Overall Experience
I tried. The number was switched off.,3,2024-11-17 17:02:00,"Bangalore, India",torinotor,Neutral,Pricing
Good solution. No one has a problem with having a segregated delivery fleet but making it conspicuously identifiable is just a recipe for disaster in this lovely little casteist country of ours.,5,2024-03-20 04:48:53,"Chennai, India",harami_murukami,Positive,Pricing
"RWAs have too
Much power, these unkill powers need to be curtailed.",5,2024-03-20 04:49:31,"Chennai, India",idc_idk6969,Positive,Pricing
How was this not factored in the first ever meeting? 😂,5,2024-03-20 04:43:18,"Hyderabad, India",Takenoshitfromany1,Positive,Delivery Speed
A corporate giant that thinks and uses common sense.. that’s a first..Mera Desh Badal Raha Hai…,2,2024-03-20 04:41:18,"Bangalore, India",Try_engineer_try,Negative,Overall Experience
"Positive step ,glad they thought about their riders safety ..you never know with these jobless right wingers these days",5,2024-03-20 04:42:45,"Mumbai, India",Anonymous,Positive,Overall Experience
"I mean, at least he listened to feedback. Sometimes it's ok to take unwise decisions if you're willing to correct them...",5,2024-03-20 04:48:16,"Bangalore, India",SuchLoan5657,Positive,Delivery Speed
Gujarati uncles will continue to scrape dustbins to find meat pieces and berate their naav veg eating tenants.,3,2024-03-20 04:55:10,"Bangalore, India",AccomplishedRoad300,Neutral,Delivery Speed
Finally sense and rationale prevailed behind this decision 👏👏👏,2,2024-03-20 05:01:50,"Chennai, India",trippymum,Negative,Delivery Speed
That’s reasonable,5,2024-03-20 04:49:33,"Bangalore, India",bhodrolok,Positive,Pricing
"Purity itself is a very problematic concept.

Won't be solved in our lifetimes.",5,2024-03-20 04:41:21,"Bangalore, India",mrrahulkurup,Positive,Customer Service
So many 16 year olds are smarter than the Zomato CEO. The fact that he didn’t realise this before rolling this travesty out is proof of that.,5,2024-03-20 08:09:27,"Bangalore, India",Infinite_Pattern_466,Positive,Overall Experience
I Mean how they didn't have idea of this. Do they know how much fear we will be having to order meat in the Vegetarian socities.,2,2024-03-20 05:09:20,"Chennai, India",Strict-Advantage8199,Negative,Delivery Speed
RWA= Right Wing Association?,5,2024-03-20 10:25:28,"Bangalore, India",LowSir3919,Positive,Delivery Speed
Deepu don’t lie. The holier than thou pure vegetarians must have hated receiving orders from a green uniformed person.,2,2024-03-20 05:27:36,"Chennai, India",Aquarius_Berry,Negative,Food Quality
"Zomato - 0

Society Uncle - 1",3,2024-03-20 05:32:48,"Delhi, India",roysouradeep,Neutral,Pricing
"Quite telling that ""pure veg"" morons are not happy with this. Because they were 100% going to intimidate and curtail delivery partners without the ""pure veg"" tag.",2,2024-03-20 05:20:28,"Bangalore, India",friendofH20,Negative,Overall Experience
Ham pe ye kisne hara rang daala,3,2024-03-20 07:21:11,"Hyderabad, India",Anonymous,Neutral,Pricing
Pakka shareholders ne bambu Diya hoga sar pe.,3,2024-03-20 05:24:05,"Delhi, India",maverick54050,Neutral,Customer Service
"Shows poor planning and execution. Although, the way forward is strategically engaging. Good for them. Would have been better had they planned well enough to avoid a rollback.",5,2024-03-20 05:02:48,"Bangalore, India",snooze_boss,Positive,Food Quality
It was a dumb decision from the get-go.,2,2024-03-20 05:12:08,"Hyderabad, India",CreativeMuseMan,Negative,Overall Experience
Let's Goooo-yal.,3,2024-03-20 05:01:54,"Hyderabad, India",kross69,Neutral,Overall Experience
"Those who secretly order non veg will be able to do so. Earlier, he could be pointed out.",5,2024-03-20 06:12:44,"Hyderabad, India",sa8ypr,Positive,Pricing
Damn...is there anyone in that management team with two brain cells to rub together.,3,2024-03-20 05:04:22,"Mumbai, India",xoogl3,Neutral,Food Quality
"Good,  saw the backlash nd decided to rollback immediately  .I too was in favour of the pure veg fleet but didn't consider the RWA nd other society  memers kha nuisance",5,2024-03-20 04:33:54,"Hyderabad, India",Paree264,Positive,Delivery Speed
Bringing out nonsense and thinking people will accept just shows how unstable the company must be.,3,2024-03-20 05:29:14,"Delhi, India",TimeVendor,Neutral,Customer Service
Good to have it corrected soon.,5,2024-03-20 05:41:01,"Mumbai, India",VolTa1987,Positive,Pricing
Good news :) Good response :),5,2024-03-20 06:03:47,"Mumbai, India",koiRitwikHai,Positive,Food Quality
An actual good decision?!? That has to be a first for these companies,5,2024-03-20 06:09:16,"Mumbai, India",Akif31,Positive,Food Quality
"I'm a vegetarian, but i welcome this rollback by Deepinder. Glad he took reviews and instantly acted on it. That's what makes startups great. An active Founder.",5,2024-03-20 06:57:17,"Chennai, India",Anonymous,Positive,Overall Experience
"If only they allow a diverse team (whose ideas are accepted) on their discussion rooms, they wouldn't have to reintroduce the Double Tumbler System with a cherry on top.",5,2024-03-20 07:56:28,"Hyderabad, India",ActualJoel,Positive,Pricing
"Wow, To take feedback and roll back a change with an explanation is good to see. 

But to feel happy about it shows how freaking low our bar is for both corporations and governments",5,2024-03-20 06:37:43,"Chennai, India",Anonymous,Positive,Food Quality
"As an outsider, it seems strange why this was even needed.",2,2024-03-20 05:28:43,"Chennai, India",sid0009,Negative,Delivery Speed
This is one of the very few topics where all the Indian subs shown unity on(be it LW or RW). Great to see all of us still uniting against stupid things.,2,2024-03-20 05:29:01,"Chennai, India",RepresentativeFar304,Negative,Delivery Speed
Good Going Deepinder,5,2024-03-20 04:57:13,"Mumbai, India",Amurthebigboy,Positive,Customer Service
This seems like something any employee would have pointed out to management.,3,2024-03-20 05:57:59,"Hyderabad, India",abkibaarnsit,Neutral,Pricing
"Master stroke! Announce a pure veg thing to signal to a section of customers. Then roll back to please the other section. Win, win!

Master class in business tactics",5,2024-03-20 05:30:50,"Delhi, India",CleanWean,Positive,Pricing
What is going on can someone please summarise the situation?,3,2024-03-20 06:05:47,"Chennai, India",Namenottakenno,Neutral,Customer Service
What’s a rwa?,3,2024-03-20 06:07:51,"Bangalore, India",PIKa-kNIGHT,Neutral,Overall Experience
*Sad Spoons provided by 70 hrs Kantaben Noises*,2,2024-03-20 07:38:23,"Mumbai, India",mayudhon,Negative,Delivery Speed
Amazing that the CEO of a Startup takes more feedback on a marketing campaign than vishwaguru did during lockdown and pandemic.,5,2024-03-20 07:45:37,"Hyderabad, India",friendofH20,Positive,Customer Service
Good! Great solution,5,2024-03-20 07:47:59,"Delhi, India",inilashremot,Positive,Customer Service
An interesting [business experiment in culture and localization… or is it just Greenwashing?](https://www.youtube.com/watch?v=IQEQr_sHDNY),5,2024-03-20 08:11:29,"Chennai, India",Change_petition,Positive,Food Quality
This is has nothing to do with religion,3,2024-03-20 08:23:11,"Delhi, India",Ashamed-Potential616,Neutral,Customer Service
This was all planned,3,2024-03-20 08:26:53,"Delhi, India",Tough_Cauliflower231,Neutral,Overall Experience
Makes sense,3,2024-03-20 09:23:02,"Delhi, India",tedxtracy,Neutral,Food Quality
"Lol. Hahahaha. 

Why wasn't this the first thing he did lmfao.",5,2024-03-20 09:32:09,"Chennai, India",rising_pho3nix,Positive,Pricing
"Kudos to Zomato for correcting it! I wonder if these companies have a good level of diversity to begin with, these are the kind of things a diverse group usually catches",5,2024-03-20 10:37:18,"Hyderabad, India",fourbyfourequalsone,Positive,Pricing
Good luck implementing it. Can't imagine what's happening in the meeting rooms of Zomato right now.,5,2024-03-20 11:08:39,"Chennai, India",swamyrara,Positive,Delivery Speed
I mean something is better than nothing lol.,5,2024-03-20 12:22:37,"Mumbai, India",loljokerishere,Positive,Food Quality
"A rare W, I'm glad he listened",5,2024-03-20 13:13:15,"Mumbai, India",FragShire,Positive,Overall Experience
https://preview.redd.it/vvys3z56xjpc1.jpeg?width=480&format=pjpg&auto=webp&s=f9baebf4aa005cd04e855f9c9c806f7b164fc32e,3,2024-03-20 20:46:59,"Bangalore, India",mylifeonearth_,Neutral,Pricing
When corporations listen ♥️♥️♥️,3,2024-03-21 00:39:15,"Bangalore, India",4LIFs,Neutral,Pricing
This is what happens when you have shitty PMs,3,2024-03-21 09:06:51,"Bangalore, India",killerdrama,Neutral,Pricing
Aur yeh bhai sahab shark tank pe ek shark hain.......,3,2024-03-21 13:06:03,"Bangalore, India",Delicious-Dinner1034,Neutral,Overall Experience
I respect Zomato,3,2024-03-20 05:13:30,"Delhi, India",Shreyash_jais_02,Neutral,Overall Experience
"Apart from different uniforms, the move is welcome. So now as that has been scrapped, this is a good initiative unless they start charging extra which is basically bs",5,2024-03-20 05:18:46,"Delhi, India",GreyDaze22,Positive,Overall Experience
They haven't rolled back food segregation. A brand must at the very least not propagate unscientific and fictional notions of purity that have led to violence in the past and continue doing so.,2,2024-03-20 10:45:03,"Mumbai, India",Anonymous,Negative,Customer Service
well not installing it back.,3,2024-03-20 05:34:35,"Mumbai, India",RowSubstantial5186,Neutral,Customer Service
Zomato's intentions have always been at the right place!,5,2024-03-20 05:20:35,"Hyderabad, India",icanliveonpizza,Positive,Delivery Speed
I don't get it. What was the problem and how was it resolved?,3,2024-03-20 07:45:01,"Hyderabad, India",AdventurousDust3,Neutral,Customer Service
"Oh, because green is Muslim color. 🤔",2,2024-03-20 07:43:57,"Mumbai, India",Designer-Winter6564,Negative,Pricing
"""Unke kapdo se pata chal jata hai""

~Supreme Leader",3,2024-03-20 08:49:58,"Mumbai, India",urge_kiya_hai,Neutral,Food Quality
"Now, how would we know if the veg delivery fleet hot boxes were used for non-veg food? /s",5,2024-03-20 05:22:14,"Mumbai, India",tifosi7,Positive,Delivery Speed
Bruh that username 😆,3,2024-03-20 06:12:48,"Bangalore, India",WhentheSkywasPurple,Neutral,Delivery Speed
I still have a problem with his yesterdays explanation of food contamination as the reason for the segregation.,3,2024-03-20 17:24:41,"Bangalore, India",coolzephyr9,Neutral,Customer Service
Surprising that they didnot have anyone internally who raised thi point...or do they choose to not listen?!,5,2024-03-20 11:15:37,"Chennai, India",Svenska2023,Positive,Food Quality
I have a problem with casteist segregation. Why don't you?,3,2024-03-21 06:18:12,"Mumbai, India",charavaka,Neutral,Delivery Speed
Unkills ko busy karwana padega koi aur cheeze me.,5,2024-03-20 05:24:39,"Chennai, India",maverick54050,Positive,Delivery Speed
"Everyday when I roam around my society in Pune, unkills discuss how Modiji has made India a superpower and I have noticed one time, unkil was reading from WhatsApp about growth.",2,2024-03-20 05:25:40,"Mumbai, India",Mayankcfc_,Negative,Food Quality
[deleted],3,2024-03-21 02:44:57,"Delhi, India",Anonymous,Neutral,Customer Service
[deleted],3,2024-03-20 18:29:22,"Hyderabad, India",Anonymous,Neutral,Pricing
It was LW who cried the most,5,2024-03-20 13:06:55,"Bangalore, India",MightyPorus,Positive,Customer Service
Exactly..seems very basic,3,2024-03-20 04:54:10,"Delhi, India",Anonymous,Neutral,Pricing
"Yes! Like that's so fucking simple, were these guys sleeping!?",3,2024-03-20 05:32:31,"Hyderabad, India",Kashish_17,Neutral,Food Quality
"elastic ink foolish crown ripe fade abounding groovy scandalous skirt

 *This post was mass deleted and anonymized with [Redact](https://redact.dev)*",3,2024-03-20 13:54:03,"Delhi, India",PrequelToMagic,Neutral,Pricing
Someone was definitely canned for this,3,2024-03-20 17:55:08,"Hyderabad, India",sateeshsai,Neutral,Overall Experience
The problem is desh vaise hi raha iske liye corporate co baldana pad raha he. But i like how belatedly he said rwa and moral policers are asshole and present in society,3,2024-03-20 05:21:03,"Mumbai, India",karandex,Neutral,Delivery Speed
"Imagine not considering and brainstorming such basic shit before an announcement of this sort

Or maybe it was just reverse psychology to grab headlines",2,2024-03-20 04:53:50,"Bangalore, India",Anonymous,Negative,Delivery Speed
They would have lost a huge amount of their non veg business to swiggy.,5,2024-03-20 08:23:01,"Chennai, India",svmk1987,Positive,Customer Service
It's all for publicity that's costing them nothing.,3,2024-03-20 14:13:42,"Chennai, India",Dookie_boy,Neutral,Food Quality
"The fact that people care about what Zomato is doing and they think its a ""corporate giant"" is the most interesting thing about internet reality.",5,2024-03-20 05:12:46,"Delhi, India",Anonymous,Positive,Food Quality
"Nah. Still not going to buy from Zomato for the exact reason. 


There's no way some logical person didn't put for these points and it wasn't discussed. This went through post all of that.",5,2024-03-20 05:56:59,"Delhi, India",Wheesa,Positive,Customer Service
[deleted],3,2024-03-20 05:18:07,"Hyderabad, India",Anonymous,Neutral,Delivery Speed
"It's not their riders safety it's their own earnings being hampered, Zomato doesn't care about its riders at all.",5,2024-03-20 06:56:19,"Hyderabad, India",the-devil-dog,Positive,Delivery Speed
"*will continue to scrape dustbins*

do people really do that? its gross and what an invasive behaviour ugh!",5,2024-03-20 11:18:30,"Chennai, India",Svenska2023,Positive,Delivery Speed
People need something to feel better than others.,5,2024-03-20 05:04:54,"Bangalore, India",sunil100k,Positive,Delivery Speed
This was a spike to see if the market would even accept such a thing.,3,2024-03-20 12:06:33,"Mumbai, India",justabofh,Neutral,Food Quality
kaafi anecdotal but chalo thik hai,3,2024-03-20 06:57:35,"Bangalore, India",Anonymous,Neutral,Pricing
so you object to your food being place next to non-veg food?,3,2024-03-21 04:48:34,"Mumbai, India",toxoplasmosix,Neutral,Customer Service
"You meant LW or RW, right? Coz there's nothing such thing called LWA and RWA isn't what you're thinking it is",5,2024-03-20 06:28:56,"Mumbai, India",sylly_mee,Positive,Pricing
Residents' Welfare Association,3,2024-03-20 06:26:16,"Hyderabad, India",sylly_mee,Neutral,Overall Experience
[deleted],3,2024-03-20 07:47:15,"Chennai, India",Anonymous,Neutral,Overall Experience
Exactly. ,5,2024-03-21 06:18:43,"Bangalore, India",charavaka,Positive,Food Quality
"I guess it was done keeping in mind, some societies don’t allow delivery partners to enter, as they might carry non-veg food for them

Having a green uniform will help societies to identify them",2,2024-03-21 06:33:53,"Bangalore, India",grumpy_hooman,Negative,Pricing
Ghar pe hi khana paka ke kha .. no doubts .. no confusion,3,2024-03-20 07:04:12,"Chennai, India",tushara9,Neutral,Pricing
What if veg delivery fleet used the same roads as non veg fleet? What will we do then?,3,2024-03-20 09:03:10,"Delhi, India",OnidaKYGel,Neutral,Pricing
Trust zomato or go to the outlet yourself,3,2024-03-20 07:53:50,"Delhi, India",prachi_19,Neutral,Overall Experience
Porn addiction krwa do unkills ko,3,2024-03-20 05:40:38,"Chennai, India",Shivam294,Neutral,Customer Service
Hopefully they mean Gobarpower,2,2024-03-20 13:12:54,"Delhi, India",Existing-Area-9093,Negative,Food Quality
All fucking jobless retired assholes with idle minds. That's why the devils are doing a work on them big time.,2,2024-03-20 20:24:51,"Bangalore, India",El_Impresionante,Negative,Food Quality
Resident welfare association. I think we mostly have Cooperative Housing Society (CHS) and their committees in india which people are now referring to as RWAs.,5,2024-03-21 08:47:16,"Delhi, India",faahqueimmanutjawb,Positive,Overall Experience
Resident welfare association. I think we mostly have Cooperative Housing Society (CHS) and their committees in india which people are now referring to as RWAs.,5,2024-03-21 08:47:12,"Hyderabad, India",faahqueimmanutjawb,Positive,Customer Service
[removed],3,2024-03-20 19:31:58,"Delhi, India",Anonymous,Neutral,Food Quality
No way this was a stunt. Too many things that could go wrong. This is plain and simple peer pressure making the company change their decision. Let’s move on ,2,2024-03-20 17:06:16,"Delhi, India",npjobs,Negative,Delivery Speed
That’s a fair assessment of the prevailing conditions. 👍,5,2024-03-20 05:39:22,"Bangalore, India",Takenoshitfromany1,Positive,Food Quality
NIT hoga,3,2024-03-21 04:41:29,"Mumbai, India",toxoplasmosix,Neutral,Pricing
Possibly? 😄,3,2024-03-20 22:53:17,"Chennai, India",Takenoshitfromany1,Neutral,Food Quality
Their severance package consists of a container full of green T-shirts they have to collect from the port.,5,2024-03-20 22:19:53,"Mumbai, India",Takenoshitfromany1,Positive,Delivery Speed
It’s a good strategy.. for them they have clearly identified the threat.. and for rwa it’s a moral boost.. they will think such a big organisation is afraid of us…it’s a win win…,5,2024-03-20 05:25:43,"Hyderabad, India",Try_engineer_try,Positive,Customer Service
Free publicity ft Zomato.,5,2024-03-20 05:12:02,"Bangalore, India",vinav2507,Positive,Overall Experience
Honestly mistakes happen.,5,2024-03-20 05:22:24,"Bangalore, India",Deep_Grey,Positive,Food Quality
Why would they get into that lol. It's just basic PR to avoid such shit.,5,2024-03-20 07:54:01,"Chennai, India",Fight_4ever,Positive,Pricing
I really don’t think they are dat smart..,5,2024-03-20 14:31:32,"Delhi, India",Try_engineer_try,Positive,Overall Experience
"That is called luck though, not being genius!",3,2024-03-20 16:04:51,"Bangalore, India",NeverBetVpOnline,Neutral,Pricing
Do they even have a choice?  I don't think riders get a say in corporate decision making,3,2024-03-20 05:31:09,"Delhi, India",unravi,Neutral,Delivery Speed
"> do people really do that?

Of course, Thats the only way they can get some protein",5,2024-03-20 13:20:41,"Hyderabad, India",Fourstrokeperro,Positive,Pricing
You think that’s worse. I had a Brahmin roommate who would clean her things when a non Brahmin touches them. But she has no problem leaving her plates on toilet floor.,2,2024-03-20 16:39:49,"Hyderabad, India",Anonymous,Negative,Delivery Speed
Bat to shi he.,3,2024-03-20 07:04:57,"Chennai, India",Anonymous,Neutral,Customer Service
"~~I eat meat~~

I guess you meant in general, fair point",5,2024-03-20 06:18:18,"Delhi, India",anonymouse_2001,Positive,Pricing
They wear a special uniform that shows this of course,5,2024-03-20 06:18:31,"Delhi, India",sid_killer18,Positive,Overall Experience
"Yeah, my bad. Messed up the terminology. LW and RW. Corrected my comment, thanks",2,2024-03-20 06:30:02,"Hyderabad, India",RepresentativeFar304,Negative,Delivery Speed
Oh thank you!,3,2024-03-21 02:11:30,"Chennai, India",Namenottakenno,Neutral,Overall Experience
"""Welfare""",3,2024-03-20 20:54:19,"Hyderabad, India",El_Impresionante,Neutral,Food Quality
