Review Text,Rating,Date,Location,Reviewer ID,Sentiment Polarity,Category
Ah. I see.,3,2024-03-20 23:45:15,"Hyderabad, India",AdventurousDust3,Neutral,Food Quality
Don't order from Zomato then.,3,2024-03-21 05:12:00,"Hyderabad, India",yeowmama,Neutral,Overall Experience
it's an Indian company.,3,2024-03-20 09:45:02,"Hyderabad, India",Ghastlytoohot,Neutral,Pricing
There is serious demand in niche sections of the society for this.,2,2024-03-21 09:15:39,"Chennai, India",ChambersColor,Negative,Food Quality
Yes but do I have to feel violated or not when ordering veg food from nonveg restaurant after “vrat” and some incident happens? /s,3,2024-03-20 09:10:00,"Hyderabad, India",bramptonmt1,Neutral,Delivery Speed
"Fuck! They all breath the same air, dude! I just realized I've been breathing in all their non-veg breaths too. Fuuuuuuuuuuck! 😨",2,2024-03-20 20:21:25,"Hyderabad, India",El_Impresionante,Negative,Overall Experience
The peshwa solution: hang brooms behind the nonveg delivery vehicles to remove the tracks. ,2,2024-03-21 06:30:56,"Chennai, India",charavaka,Negative,Customer Service
They need to evolve from blue films,3,2024-03-20 06:58:01,"Chennai, India",WhiteWraith16,Neutral,Customer Service
They are already addicted to soft porn readily available on Instagram and YouTube shorts,5,2024-03-20 12:24:09,"Delhi, India",LeAnarchiste,Positive,Delivery Speed
Instagram reels nahi chalengi?,3,2024-03-20 15:57:36,"Delhi, India",Titanium006,Neutral,Pricing
"Khada nai hota

-source: am an uncle",3,2024-03-20 10:27:00,"Bangalore, India",monk-e7,Neutral,Customer Service
"Most of the civil servant dominated seats in Delhi vote for AAP lol , actual bureaucrats know whats up",5,2024-03-20 08:21:13,"Bangalore, India",Certain_Ingenuity_34,Positive,Pricing
Are whatsapp uncle the main issue with india. If we remove them our gdp will go brrrrr,5,2024-03-20 05:53:53,"Bangalore, India",karandex,Positive,Delivery Speed
"This is why we red team blue team everything, we prefer to avoid situations where we will be caught with our pants down. I guess zomato needs more merit in its teams",5,2024-03-20 05:28:47,"Delhi, India",anonymouse_2001,Positive,Delivery Speed
"I believe that human intelligence reduces when adding together, therefore larger the organisation the dummer it behaves..an organisation releasing how dum its decision is a miracle…",3,2024-03-20 05:00:32,"Hyderabad, India",Try_engineer_try,Neutral,Customer Service
This is more oblivion I guess. How can you miss major part in our country which is food and Politics behind it.,5,2024-03-20 05:01:49,"Chennai, India",Strict-Advantage8199,Positive,Overall Experience
Well you are wrong about that. You will be surprised how detailed most companies get when launching new stuff. Yet mistakes can happen. Kudos they corrected their mistake.,5,2024-03-20 07:49:38,"Mumbai, India",Fight_4ever,Positive,Food Quality
They say the same about you and me.,3,2024-03-21 04:40:16,"Delhi, India",Dookie_boy,Neutral,Customer Service
[deleted],3,2024-03-20 07:51:33,"Delhi, India",Anonymous,Neutral,Delivery Speed
They do when there's an equal competitor in the market aka Swiggy. If the riders aren't happy with Zomato they can easily migrate to Swiggy or other gig based apps,5,2024-03-20 18:12:44,"Hyderabad, India",really_thirsty_lemon,Positive,Pricing
I meant 'landlords' as per the context...,3,2024-03-20 14:20:11,"Hyderabad, India",Svenska2023,Neutral,Delivery Speed
That's exactly what it is. Their kachra is okay but other's things are kachra for them,5,2024-03-20 18:18:26,"Delhi, India",really_thirsty_lemon,Positive,Overall Experience
"What if they are a closeted non-vegetarian, and can't come out due to circumstances?",2,2024-03-20 06:23:26,"Bangalore, India",anonymouse_2001,Negative,Customer Service
bastard non veg eating majority of india!,3,2024-03-21 08:37:42,"Delhi, India",OnidaKYGel,Neutral,Delivery Speed
Ezzsnippet aake JS padha ke chala jayega gaand fatt jayegi sabki,3,2024-03-20 16:13:23,"Bangalore, India",Shivam294,Neutral,Delivery Speed
Papa moosewala: pathetic,2,2024-03-20 10:42:04,"Hyderabad, India",Shivam294,Negative,Pricing
WhatsApp uncle mantality is the most common way of thinking.. if u remove that I am not sure what remains can be called india..,2,2024-03-20 11:52:19,"Chennai, India",Try_engineer_try,Negative,Delivery Speed
"Absolutely. If this feature is headed by someone influential, good chance that no one else wanted to speak up to them. Definitely needs more merit in their teams",5,2024-03-20 05:30:41,"Hyderabad, India",shadow_clone69,Positive,Delivery Speed
The opposite in scientific research,3,2024-03-20 08:50:15,"Mumbai, India",adwarakanath,Neutral,Customer Service
I don’t think companies really understand the concept of “thinking things through”.. they just do things they feel like doing..,5,2024-03-20 05:22:01,"Delhi, India",Try_engineer_try,Positive,Customer Service
Could be true..🤫🤔,3,2024-03-21 13:00:15,"Chennai, India",Try_engineer_try,Neutral,Pricing
Can the delivery person survive prolonged national strike ?,3,2024-03-20 09:56:50,"Chennai, India",unravi,Neutral,Overall Experience
Yeah it was a stupid joke implying that scraps were the only source of protein for these despotic landlords,2,2024-03-20 14:25:08,"Delhi, India",Fourstrokeperro,Negative,Pricing
Yea. Surely everyone is dumb.,5,2024-03-20 07:51:52,"Delhi, India",Fight_4ever,Positive,Delivery Speed
Ooo boy you need to read Thomas Kuhn's structure of scientific revolutions.,3,2024-03-21 20:08:30,"Mumbai, India",adwarakanath,Neutral,Delivery Speed
Most delivery agents don't even bother to wear the uniform rn. I wonder how they're going to enforce this.,5,2024-03-19 12:22:39,"Mumbai, India",Anonymous,Positive,Overall Experience
Soon there will be clash among pure veg vs non veg fleet,5,2024-03-19 11:40:34,"Chennai, India",Outrageous-Drop-9926,Positive,Overall Experience
Next up(very likely from Gujarat): Housing society bans all non-veg delivery drivers,3,2024-03-19 12:51:22,"Delhi, India",kvketan,Neutral,Delivery Speed
What next... Only vegetarian drivers for delivering vegetarian food?,3,2024-03-19 12:19:05,"Mumbai, India",bluegoldredsilver5,Neutral,Overall Experience
Solving problems that don't exist,3,2024-03-19 13:12:01,"Delhi, India",Anonymous,Neutral,Pricing
"Soon we are going to have traveling chefs and kitchens. ""We cook in front of you. Be 100% sure.""",5,2024-03-19 11:47:29,"Hyderabad, India",Damini-on,Positive,Delivery Speed
Quite an innovation you see : Untouchability as a service (UaaS) 🤡,3,2024-03-19 12:39:50,"Hyderabad, India",Julius_seizure_2k23,Neutral,Customer Service
I thought I was on /r/theonion,3,2024-03-19 13:58:13,"Mumbai, India",chandu1256,Neutral,Delivery Speed
"Do they check for caste also?

Will Muslim drivers be allowed on Pure Veg Fleet? Just fucked up!",2,2024-03-19 12:50:03,"Hyderabad, India",spetika,Negative,Customer Service
In Modi's next term we might have religion and caste based delivery fleets,3,2024-03-19 12:23:05,"Chennai, India",Annual-Macaroon-7315,Neutral,Pricing
"I am a vegetarian also a businessman, don't understand this marketing of trying to please a minority group like us 🤷 ",3,2024-03-19 12:22:31,"Delhi, India",No-Error4534,Neutral,Pricing
"Sudha will still use her own spoons, thank you very much. ",5,2024-03-19 13:01:22,"Delhi, India",charavaka,Positive,Food Quality
"Those putting forward the idea of ""Pure"" People are the most impure ones.",5,2024-03-19 13:12:44,"Chennai, India",mayudhon,Positive,Delivery Speed
Next up: Pure Brahmin Fleet🫡,5,2024-03-19 12:34:24,"Hyderabad, India",Proof-Web1176,Positive,Food Quality
What next? Hire delivery guys that are pure veg? You know where this is heading.,5,2024-03-19 11:41:37,"Chennai, India",harami_murukami,Positive,Pricing
"And, these are the people who freak about when Muslims ask for halal food. 😂",3,2024-03-19 13:03:04,"Mumbai, India",be_a_postcard,Neutral,Overall Experience
Looks like Rishabh Pant has fallen on hard times after injury.,2,2024-03-19 14:10:51,"Delhi, India",VaikomViking,Negative,Delivery Speed
"Next up: No onion, no garlic fleet",3,2024-03-19 13:55:54,"Delhi, India",me0din,Neutral,Overall Experience
Goyal took “Kapde se pechane jayenge” way too seriously. Genuinely stupid idea.,2,2024-03-19 12:40:23,"Bangalore, India",Anonymous,Negative,Customer Service
[deleted],3,2024-03-19 13:01:45,"Bangalore, India",Anonymous,Neutral,Food Quality
"Nothing but a PR move, fix the spillage issue rather than wasting so many resources on this PR stunt and still not addressing the actual issue of spillage.",5,2024-03-19 17:28:12,"Delhi, India",EscapeVirtual1440,Positive,Food Quality
Why is everyone so pressed in the comments... This sounds perfectly fine to me and I'm a non vegetarian.,5,2024-03-19 20:55:38,"Delhi, India",jaun_sinha,Positive,Overall Experience
I've never seen this many people mad about an imaginary issue that they created on their own than this comment section,5,2024-03-19 14:34:25,"Delhi, India",Illustrious-Shock551,Positive,Pricing
What the fuck is even this Pure veg. What is Pure about veg? What is impure about non veg lol,5,2024-03-19 12:27:45,"Hyderabad, India",Upper-Test-9930,Positive,Pricing
"i dont see anything wrong with this, you're hating on them just for the sake of hating   
if a zomato wants to launch a pure vegetarian alternative good for them",5,2024-03-19 13:19:26,"Chennai, India",BEAST_WORK6969,Positive,Pricing
One more topic to divide the people of our nation tera zomato alag mera zomato alag,5,2024-03-19 12:38:32,"Hyderabad, India",MANTOf1,Positive,Food Quality
Muje kya mere paise to ipo me kha gaye 😑,2,2024-03-19 13:16:03,"Mumbai, India",Neon7npi,Negative,Customer Service
More options are always welcome!,5,2024-03-19 14:30:17,"Bangalore, India",Anonymous,Positive,Delivery Speed
I want a pure non veg fleet and no veg food should have touched the zomato box ever.,5,2024-03-19 15:01:02,"Bangalore, India",bl4blu3,Positive,Overall Experience
🤢,3,2024-03-19 16:32:15,"Chennai, India",Anonymous,Neutral,Food Quality
Stupid brain dead move further dividing people,2,2024-03-19 16:32:22,"Delhi, India",nopetynopetynops,Negative,Customer Service
"Addressing pointless concerns before the important ones…why waste resources on this? As if there is not already strain on the supply chain, they want to further spread it thinner?",2,2024-03-19 16:45:13,"Bangalore, India",Bitter_Dingo516,Negative,Pricing
"But why? Isn't it another marketing gimmick? You can pick Pure Veg or Veg Only options anyway, and you can pick restaurant which Only serve Veg already. So! What's new, the Green color?",5,2024-03-19 17:39:37,"Chennai, India",ishisenpai,Positive,Food Quality
"A person who eats halal food is following his beliefs.

But a person who eats vegetarian food is a casteist.",3,2024-03-20 02:28:52,"Hyderabad, India",Personal-Ad-8250,Neutral,Food Quality
Nothing wrong if they feel they are responding to a customer need rather than virtue signaling?,2,2024-03-20 04:50:24,"Delhi, India",qwertying23,Negative,Delivery Speed
They will attack the ones in red now.,3,2024-03-19 13:04:05,"Delhi, India",the-devil-dog,Neutral,Pricing
This is some mad casteism,2,2024-03-19 15:11:01,"Delhi, India",TeammateTox,Negative,Delivery Speed
"Pure, eh? So everything else is impure, one assumes.",5,2024-03-19 11:54:18,"Hyderabad, India",chaakyar,Positive,Pricing
Why are people here so against this? ,3,2024-03-19 13:33:20,"Chennai, India",rnjbond,Neutral,Customer Service
"""Pure veg"" is an Indianism rooted in casteist thinking. https://theprint.in/opinion/pure-vegetarian-restaurant-aka-brahminism-implicitly-served/30374/",5,2024-03-19 12:06:30,"Bangalore, India",tech-writer,Positive,Pricing
"OMG, the comment section shows the rotten brain of people. 

Vegetarian person can be of any religion, its a preference, not a religious identity.",3,2024-03-19 13:39:38,"Bangalore, India",5Doublu,Neutral,Delivery Speed
"India is a free country, if someone is preferred to eat only halal food , so does a ""pure veg food"" . I don't see it as a big controversy, ppl just making assumptions.",5,2024-03-19 16:39:00,"Mumbai, India",Deep-Brilliant9064,Positive,Delivery Speed
"Translation: ""we have a good % of grass eaters, let's charge them more gradually to punish their selective behaviour. Long live carnivores""",5,2024-03-19 13:05:41,"Hyderabad, India",elongatedpepe,Positive,Overall Experience
You can't argue with Idiots...just have a chilled beer and beef,3,2024-03-19 12:54:53,"Chennai, India",Anonymous,Neutral,Overall Experience
Can we have a separate non veg option as well which does not get close to pure veg containers or carry bags?,5,2024-03-19 13:14:19,"Hyderabad, India",sku-mar-gop,Positive,Overall Experience
[deleted],3,2024-03-19 13:51:37,"Chennai, India",Anonymous,Neutral,Overall Experience
"Full support to any idea that increases employment, finds takers ready to pay for this...",5,2024-03-19 13:18:58,"Chennai, India",Sea_Assignment741,Positive,Pricing
What is the difference between veg and pure veg?,5,2024-03-19 13:25:47,"Mumbai, India",luffy69hankcock,Positive,Delivery Speed
"Don't they already have a pure veg section on Zomato? Why the further divide?? As long as the food is properly packed, there's no need for a separate delivery service.",5,2024-03-19 13:51:37,"Bangalore, India",torrential-monsoon,Positive,Food Quality
"good idea , but i don't want to see a post where a veg family is showing a bone in there food , soo please take this seriously",5,2024-03-19 11:53:53,"Bangalore, India",Anonymous,Positive,Delivery Speed
Vegetarian fleet for a country with 65-70% non vegetarians.,3,2024-03-19 13:54:55,"Delhi, India",Outrageous-Kale9545,Neutral,Overall Experience
All these PPL here will never speak up about Halal food but here they will type all the conspiracy which has not even happened,3,2024-03-19 14:29:52,"Hyderabad, India",sanditt420,Neutral,Delivery Speed
[deleted],3,2024-03-19 12:19:09,"Delhi, India",Anonymous,Neutral,Overall Experience
Aha.. what are we reinventing fire again in the next episode? ,3,2024-03-19 13:10:52,"Delhi, India",FoxBackground1634,Neutral,Delivery Speed
New app?,5,2024-03-19 14:25:30,"Bangalore, India",Anonymous,Positive,Food Quality
How will this change the cooking utencils and procedures of restaurants?,3,2024-03-19 14:25:54,"Chennai, India",Swadeshn2,Neutral,Overall Experience
The new caste system is in making where non veg eaters are untouchables😏,5,2024-03-19 14:35:54,"Chennai, India",Automatic_Second8611,Positive,Pricing
Pure casteism.,5,2024-03-19 14:38:44,"Hyderabad, India",Juvegamer23,Positive,Overall Experience
Noice,3,2024-03-19 14:44:41,"Mumbai, India",Vis09,Neutral,Pricing
kuch bhi,3,2024-03-19 14:46:57,"Bangalore, India",Lullan_senpai,Neutral,Overall Experience
Time to start a new political party for Non-vegetarians.,5,2024-03-19 14:49:54,"Hyderabad, India",naveenpun,Positive,Customer Service
That's just stupid,2,2024-03-19 14:56:24,"Delhi, India",Dalindarmodi,Negative,Pricing
https://preview.redd.it/pb1syyy12bpc1.jpeg?width=1170&format=pjpg&auto=webp&s=81723f44172357710901d080866c05d765281c15,3,2024-03-19 14:58:23,"Hyderabad, India",snarky_AF,Neutral,Pricing
Fruitcakes,3,2024-03-19 15:16:47,"Chennai, India",FragShire,Neutral,Overall Experience
Pure veg wala agar tere khane mein thukega toh bhi tera vegiterianism nahi tutega,5,2024-03-19 15:37:21,"Bangalore, India",vkilewala,Positive,Delivery Speed
"Only in India.

Next stop ""Halal only"" fleet? /s",3,2024-03-19 15:41:54,"Bangalore, India",desi_guy11,Neutral,Food Quality
"Hey any updates on when they are gonna implement a fleet for “impure vegetarians” like me? (prefer veg but occasionally eat non veg) 

/s",3,2024-03-19 15:42:16,"Chennai, India",pragmaticutopian,Neutral,Delivery Speed
What about that guy who requested not to mention chicken on food and asked to send cutlery 😂😂,2,2024-03-19 15:53:36,"Hyderabad, India",00Nitro00,Negative,Customer Service
"Zomato gaand maraye,idhar kaddu kharidne ke paise hi nhi hai,online order ghanta karunga.",3,2024-03-19 15:55:06,"Chennai, India",Competitive-Form-746,Neutral,Overall Experience
Pure Veg Fleet are just a blatant rip off of Veg Zeppelin.,2,2024-03-19 16:15:47,"Hyderabad, India",Jaffacus92,Negative,Food Quality
"So will the pure veg restaurants be removed from the ""non-veg"" zomato!!! :)",5,2024-03-19 16:22:29,"Delhi, India",red_jd93,Positive,Overall Experience
And what about Chef or cook who is preparing pure veg food?🤔,5,2024-03-19 16:32:47,"Chennai, India",koustubhavachat,Positive,Delivery Speed
next they will say only UC rider will handle the food then ?,3,2024-03-19 17:40:26,"Bangalore, India",99deeds,Neutral,Pricing
Careem jaisa uniform hai. Dont worry guys sabko do uniform de denge,3,2024-03-19 21:23:06,"Bangalore, India",ControlSouthern3825,Neutral,Overall Experience
This just feels like casteism and untouchability all over again.,3,2024-03-20 04:24:54,"Bangalore, India",quiet_merc,Neutral,Customer Service
Delivery agents are going to carry multiple devices once this policy gets enforced so that they can get both kind of orders.,5,2024-03-20 10:36:20,"Delhi, India",delicious_fungi,Positive,Food Quality
"""Pure Veg"" is code for UC Hindu only.",5,2024-03-19 13:32:50,"Hyderabad, India",sayzitlikeitis,Positive,Delivery Speed
W move goyal.,3,2024-03-19 13:41:06,"Hyderabad, India",Anonymous,Neutral,Overall Experience
I totally support this step. Being vegetarian it's really agitating when your delivery guy hands over wrong order that too some sort of non veg product. It has happened with me couple of times.,2,2024-03-19 12:55:46,"Hyderabad, India",cumposer,Negative,Food Quality
Now all 💙 neela Chhadi gonna link it to Caste & Brahmins 😂,3,2024-03-19 12:22:26,"Hyderabad, India",Ok_Platform_20,Neutral,Pricing
Catering to bigots 🤡,3,2024-03-19 14:06:28,"Chennai, India",Benjammer10,Neutral,Overall Experience
So only Jains or Brahmin drivers will deliver food /s,3,2024-03-19 13:44:17,"Bangalore, India",triggered_troll,Neutral,Pricing
Now Sanghi Housing Societies will ban entry of Red Zomato delivery guys or harass them unnecessarily.,2,2024-03-19 16:49:27,"Delhi, India",nafivim753,Negative,Delivery Speed
"Pure Veg Only Temples When?

Oh Wait...",5,2024-03-19 13:07:38,"Chennai, India",quietmusk,Positive,Delivery Speed
"The best step would have been to assign vegetarian people to deliver non-veg, Iykyk",5,2024-03-19 13:15:11,"Delhi, India",Winterforyou,Positive,Overall Experience
It’s good they solved the problem of bigots not paying because food was delivered by a Muslim delivery executive.,5,2024-03-19 13:19:07,"Chennai, India",john_wick_909,Positive,Customer Service
Yeah dude like this will save your low margin sinking ship,3,2024-03-19 13:24:32,"Chennai, India",dapperman99,Neutral,Food Quality
"Pandering. 
What’s next - Gonna hire pure veg people too?",5,2024-03-19 13:57:42,"Delhi, India",Noooofun,Positive,Customer Service
Bro too tired of getting complaints about m*slim delivery guys! Gives a pure veg option for that😂😂😂,2,2024-03-19 14:03:50,"Delhi, India",Sharp-Cell-1332,Negative,Delivery Speed
Another way for people to lose their tatti over drivers who wear the wrong colour shirt while delivering their sanskari chow-mein food.,2,2024-03-19 14:10:58,"Mumbai, India",TrinityF,Negative,Overall Experience
"Green = muslim color, that's the logic of bhakts. I expect a backlash.",2,2024-03-19 14:34:22,"Mumbai, India",Egg_Chicken_Roll,Negative,Delivery Speed
I hope they charge a bomb for their pure veg deliveries so that the people who order get their Gravity centres ruptured.,5,2024-03-19 15:12:06,"Bangalore, India",Randomguy0864,Positive,Delivery Speed
Zomato Caste System **™**,3,2024-03-19 16:36:08,"Delhi, India",saarth_,Neutral,Delivery Speed
Why not? It’s an inclusive step,3,2024-03-19 19:02:23,"Chennai, India",Technical_Sand4723,Neutral,Delivery Speed
"Fucking ridiculous, the lengths some vegetarians go to make themselves insufferable.",2,2024-03-19 12:55:57,"Delhi, India",brobdingnagianaf,Negative,Pricing
Markets are ALWAYS driven by demand. There is demand from vegetarian food (just like non vegetarian foods) and Pure Veg Fleet is actually a good example if a private company is trying it.,5,2024-03-19 13:31:04,"Chennai, India",nikhilsharmass,Positive,Overall Experience
What a clown,3,2024-03-19 13:17:45,"Bangalore, India",OrdinaryAndroidDev,Neutral,Delivery Speed
Big time bigot,3,2024-03-19 13:48:40,"Hyderabad, India",Waterlemon_Sugar,Neutral,Delivery Speed
"Ain't it promotion of  ""untouchability""",3,2024-03-19 14:01:31,"Mumbai, India",le_stoner_de_paradis,Neutral,Delivery Speed
It's nothing compared to Halal product bullshit which somehow include pen's nip to pant's zip,3,2024-03-19 17:38:21,"Delhi, India",Ankit0947,Neutral,Delivery Speed
I want pure-meat fleet and mode as well! No pure veg food from any any pure veg restaurant should show up in my app!,5,2024-03-19 13:24:07,"Bangalore, India",DifficultyDowntown,Positive,Pricing
Bhai innovation chahiye tha Pure Veg Restaurants already exist karte he. Dabbe me Dabba dabbe me aaloooo,5,2024-03-19 13:39:57,"Chennai, India",fahadsayed36,Positive,Overall Experience
Zomato needs to be banned for this so that no other company can pull this trick,5,2024-03-19 14:25:51,"Delhi, India",Anonymous,Positive,Delivery Speed
So when is pure non veg fleet coming?,5,2024-03-19 14:32:17,"Delhi, India",AbhilashHP,Positive,Food Quality
Why are they using green? Go back to Pakistan?,2,2024-03-19 14:38:41,"Mumbai, India",Anonymous,Negative,Food Quality
