Review Text,Rating,Date,Location,Reviewer ID,Sentiment Polarity,Category
Those look like flavors of juice that you put into your vapes. Pricing also look consistent.,5,2024-11-17 10:34:47,"Hyderabad, India",Melodic-Economist114,Positive,Customer Service
try ordering and tell what you found,3,2024-11-17 10:12:43,"Delhi, India",tempest_aww,Neutral,Food Quality
Interested in answers,5,2024-11-17 10:08:35,"Hyderabad, India",crasherdgrate,Positive,Delivery Speed
Definitely code for something. But definitely not money laundering. ,3,2024-11-17 10:31:23,"Mumbai, India",Ashamed-Tooth,Neutral,Pricing
Use COD and order and give us an update.,3,2024-11-17 10:14:02,"Bangalore, India",-CanYouHearTheMusic-,Neutral,Delivery Speed
"All are in same location ""NayaGaon""",3,2024-11-17 10:24:34,"Mumbai, India",danielricardo1,Neutral,Customer Service
"Could it be a way to deliver drugs? With price this high, only a 'few' people will order. And them few will already be aware of what it contains, i.e., drugs. Just a thought.",5,2024-11-17 10:09:58,"Mumbai, India",Aromatic-Essay-623,Positive,Food Quality
Okay not sure if it's the same but naughty strawberry is also a variant of LSD and normally one bloat should be around 800 to 1.5k (although it may be higher these days) so yeah,5,2024-11-17 11:39:26,"Delhi, India",LordVillageHoe,Positive,Overall Experience
Why did my mind go to prostitution?Guess we'll never know.,3,2024-11-17 11:05:20,"Mumbai, India",YetSomeRandom,Neutral,Overall Experience
I guess they're adding Prime and Feastables in those items then it makes sense,3,2024-11-17 10:11:10,"Delhi, India",DesiThor007,Neutral,Customer Service
Nayagaon hai toh it's definitely something related to drugs. Either that vape thing like someone mentioned or its marijuana/hash.,3,2024-11-17 12:01:57,"Delhi, India",AnthonyGonsalvez,Neutral,Customer Service
Money laundering,3,2024-11-17 10:05:45,"Bangalore, India",Chakravartin_Arya,Neutral,Pricing
udta punjab,3,2024-11-17 10:11:47,"Hyderabad, India",cdrfrk,Neutral,Customer Service
Concaine ain't cheap man.,5,2024-11-17 10:26:06,"Bangalore, India",robb981o,Positive,Delivery Speed
"This is multi brand kitchen as per Zomato

https://preview.redd.it/raddywzzig1e1.png?width=1080&format=pjpg&auto=webp&s=bfa58153582b8fdc5e3e7d81afcd3c807563494d",3,2024-11-17 12:40:42,"Mumbai, India",Ioosubuschange,Neutral,Delivery Speed
Looks like drug business,3,2024-11-17 10:30:52,"Delhi, India",Sea_Tip_858,Neutral,Food Quality
"i am free today lol , thinking of going to these restaurants , would update soon",5,2024-11-17 11:42:28,"Delhi, India",Moongfali4president,Positive,Overall Experience
"I ll sponsor 100 , if you find some people like me please order that and see what they are selling",3,2024-11-17 11:13:53,"Mumbai, India",Palmar_Aponeurosis,Neutral,Food Quality
"Could be either drugs, escorts or money laundering.",3,2024-11-17 10:56:23,"Bangalore, India",Soul_lessDNA,Neutral,Pricing
Ganja.,3,2024-11-17 10:32:32,"Mumbai, India",ANIKET_UPADHYAY,Neutral,Food Quality
Can anyone help me create a twitter post for this?,3,2024-11-17 17:35:26,"Chennai, India",torinotor,Neutral,Pricing
I think is gonna be the biggest news to start the 2025? Full year will go in the investigation 🫡,5,2024-11-17 19:56:37,"Bangalore, India",The_Indian_News,Positive,Pricing
Udta Punjab moment,3,2024-11-17 10:24:31,"Hyderabad, India",Equal_Resolve9802,Neutral,Pricing
Try ordering and let us know,3,2024-11-17 10:47:34,"Bangalore, India",Altruistic_Entry_803,Neutral,Overall Experience
I'll take a naughty strawberry,2,2024-11-17 10:57:52,"Mumbai, India",shwarmaa_naman,Negative,Delivery Speed
This looks like the Cherry Poppers ' Ice Cream ' from GTA Vive City. Feeling suspicious about it.,3,2024-11-17 11:46:00,"Chennai, India",Background-Pie-961,Neutral,Delivery Speed
Vapes,3,2024-11-17 11:53:26,"Hyderabad, India",Cigarettes_at_beach,Neutral,Overall Experience
we need an internet rabbithole yt video on this ASAP,3,2024-11-17 20:58:02,"Chennai, India",nottshakkeyy,Neutral,Food Quality
"https://preview.redd.it/cv8a6rku8t1e1.jpeg?width=1080&format=pjpg&auto=webp&s=77a86d39293412bbb023502aebc2288d55a7c301

Someone here is journalist!",3,2024-11-19 07:26:56,"Delhi, India",100ravvv,Neutral,Customer Service
"Just checked in Zomato.. 

All the restaurant's opening timing is the same...",3,2024-11-17 11:41:57,"Mumbai, India",Rawan_On_Earth,Neutral,Overall Experience
"I think 

https://preview.redd.it/yjer2uzcrl1e1.png?width=540&format=png&auto=webp&s=defac48d2bf42927fb0501c41983ec44f93cc05c",3,2024-11-18 06:16:28,"Hyderabad, India",OceanFloor,Neutral,Overall Experience
"there are ratings on them, what do they say?",3,2024-11-17 10:55:34,"Bangalore, India",nickbuck28,Neutral,Food Quality
Mostlikely drugs of sort.,3,2024-11-17 11:53:09,"Delhi, India",Zestyclose_Mud2170,Neutral,Pricing
Flavored weed strains,3,2024-11-17 12:52:30,"Hyderabad, India",rizkreddit,Neutral,Pricing
"This seems like one of the presentations the Indian kid will give in his US business school class about “Indian” innovation. But I gotta say, that’s pretty damn clever!",5,2024-11-17 15:23:42,"Bangalore, India",Mydesilife,Positive,Customer Service
could be alcohol or some banned substances,3,2024-11-17 17:45:00,"Chennai, India",EnvironmentalAir2719,Neutral,Customer Service
It's most probably a tester restaurant.,5,2024-11-17 22:05:49,"Chennai, India",dupdupdup3,Positive,Overall Experience
Punjabi drugs hoga usme 😂else 999 cofee to lunkbucks bhi nhi deta,3,2024-11-17 10:47:18,"Chennai, India",Fearless-Apartment50,Neutral,Pricing
Dis dem drugs stop posting them let people enjoy drugzzzzzzzz,5,2024-11-17 10:19:19,"Mumbai, India",parthpalta,Positive,Customer Service
Sex service maybe 🤔,3,2024-11-17 10:27:35,"Chennai, India",jadhavsaurabh,Neutral,Food Quality
Drugs!!,3,2024-11-17 10:52:48,"Delhi, India",Anagha-1998,Neutral,Customer Service
possibly vape sellers,3,2024-11-17 11:06:56,"Bangalore, India",prakulllllllllll,Neutral,Food Quality
vapes,3,2024-11-17 11:49:02,"Bangalore, India",Ferocious_Alpha,Neutral,Customer Service
It’s either Hookah or vape,3,2024-11-17 11:53:12,"Chennai, India",Limp_Organization728,Neutral,Overall Experience
Order and find out.,3,2024-11-17 13:46:03,"Delhi, India",bhodrolok,Neutral,Overall Experience
[deleted],3,2024-11-17 13:52:10,"Chennai, India",Anonymous,Neutral,Pricing
Remindme! 1day,3,2024-11-17 14:08:28,"Bangalore, India",me_n_mybadasscurls,Neutral,Delivery Speed
I pity those who ordered and put up a review,2,2024-11-17 14:53:36,"Chennai, India",dhruvDAG17,Negative,Food Quality
Something like pizzagate?,3,2024-11-17 15:02:20,"Bangalore, India",StrikingMaterial1514,Neutral,Food Quality
This seems like prostitution or sex trafficking.,3,2024-11-17 15:12:26,"Mumbai, India",SugarSaltLimes,Neutral,Food Quality
"I mean money laundering ke liye koi Zomato pe listing daalke kya hi karega, uska revenue toh traceable hoga",2,2024-11-17 15:16:07,"Mumbai, India",CapnB0rt,Negative,Customer Service
Phone charge karle bhai,3,2024-11-17 15:18:53,"Hyderabad, India",ProfessionalSteak602,Neutral,Overall Experience
Sounds like vape flavours,3,2024-11-17 15:37:33,"Chennai, India",FineWash5667,Neutral,Customer Service
You found something intriguing maybe report it to Zomato before taking any action?,5,2024-11-17 16:10:41,"Delhi, India",foxietails,Positive,Food Quality
Weed buddy. Weed.,3,2024-11-17 16:37:57,"Mumbai, India",GooglyMoogly122,Neutral,Delivery Speed
Alcohol? Maybe?,3,2024-11-17 16:38:11,"Chennai, India",Acrobatic_Mistake_40,Neutral,Pricing
"They are running a PoC hehehe, MVP it seems😂",3,2024-11-17 16:48:30,"Bangalore, India",alphacobra99,Neutral,Food Quality
Bhai COD pe mangao aur Hume b batao,3,2024-11-17 16:50:45,"Hyderabad, India",chatgptbotindia,Neutral,Overall Experience
"Didn’t even know this was a thing. Really good finding, OP.

Anyone know if such a set up exists outside Chandigarh?",5,2024-11-17 17:30:13,"Mumbai, India",vyrusrama,Positive,Delivery Speed
Interesting post,5,2024-11-17 17:52:49,"Bangalore, India",Connect-Currency200,Positive,Pricing
Its just some guy trying out the application dont over react,3,2024-11-17 20:27:24,"Chennai, India",AncientArugula3939,Neutral,Overall Experience
"Cloud kitchens, and selling goods to take you to straight to the clouds.",5,2024-11-17 21:01:17,"Mumbai, India",blackbowtieandgun,Positive,Overall Experience
Cloud kitchen,3,2024-11-17 22:56:37,"Bangalore, India",Super-Ad5662,Neutral,Food Quality
"Well, we *are* living in the era of super-specialization. :)",5,2024-11-18 02:08:59,"Bangalore, India",pencilmarkerstylus,Positive,Pricing
Great find man. Definitely shady.,5,2024-11-18 02:31:53,"Delhi, India",ThinkingIndian,Positive,Customer Service
"Its a vape delivery front, it works whereby you contact the pd they say you can order from zomato and then you place ur order and it gets accepted. Key is to call the pd.",3,2024-11-18 02:35:29,"Delhi, India",Viceous98,Neutral,Food Quality
They’re selling pussy duh.,2,2024-11-18 03:36:41,"Hyderabad, India",ThisDidntAgeWell,Negative,Food Quality
"See the reviews

https://preview.redd.it/j26rg78x0l1e1.png?width=1440&format=pjpg&auto=webp&s=2a0e6f0e6279d4659837ff60708874ad0cf52698",3,2024-11-18 03:42:26,"Bangalore, India",rohithkumarsp,Neutral,Customer Service
"""Babu Ram Chinese Fast Food"" is taking me out",5,2024-11-18 04:11:31,"Bangalore, India",tsb1021,Positive,Pricing
And the strawberry looks tad bit naughty,2,2024-11-18 04:39:40,"Hyderabad, India",Enough_Technology_95,Negative,Customer Service
"Owner be like 
I sell what I like not what you like",3,2024-11-18 04:56:45,"Delhi, India",falcon9722,Neutral,Pricing
Definitely a drug racket.,3,2024-11-18 05:30:05,"Chennai, India",RogueDoga,Neutral,Delivery Speed
looks like a front for a vape buisness,3,2024-11-18 05:58:25,"Delhi, India",alibabaakirand,Neutral,Delivery Speed
Has someone put this on Twitter already?,3,2024-11-18 06:43:12,"Mumbai, India",NoZombie2069,Neutral,Food Quality
Order it and find out,3,2024-11-18 06:47:43,"Delhi, India",Ok_Astronomer_1308,Neutral,Pricing
"https://x.com/nitish_an/status/1858407483682779178?s=46

Let’s get this rolling",3,2024-11-18 07:12:35,"Bangalore, India",torinotor,Neutral,Overall Experience
I have a friend who has fake restaurants listed.. he owns a restaurant and he has created 4 restaurants out of it in Zomato 😂..same item’s different names,2,2024-11-18 08:59:00,"Mumbai, India",Efficient_Invite_237,Negative,Pricing
My guess is something else is being dealt here. Most probably prostitution or drug.,5,2024-11-18 11:03:33,"Hyderabad, India",_qub3,Positive,Overall Experience
Hookah flavor lg rha h 😅 ky chal rha h Chandigarh m,3,2024-11-18 13:48:56,"Chennai, India",InterestingEgg2960,Neutral,Delivery Speed
HOOKERS!,3,2024-11-18 14:16:43,"Chennai, India",Fluid-Albatross3419,Neutral,Food Quality
Weed suppliers perhaps,3,2024-11-18 15:39:34,"Chennai, India",FewKaleidoscope9894,Neutral,Customer Service
Chila chila ke sab ko scheme mein batade!!,3,2024-11-18 18:56:05,"Mumbai, India",No_Turnip8611,Neutral,Pricing
I think it’s vape. Those are vape flavours,3,2024-11-18 20:13:30,"Delhi, India",dr_batmann,Neutral,Pricing
Following,3,2024-11-18 23:43:26,"Bangalore, India",Kashish_17,Neutral,Customer Service
"For those saying it's drugs, why would someone give 10+% commission to zomato for each order value just to get a delivery guy. There are much more efficient ways of doing this.",5,2024-11-19 03:47:31,"Delhi, India",insaneguitarist47,Positive,Customer Service
"As someone who is from this industry, a lot of times these are just test stores created by the brand or zomato for testing some new feature",5,2024-11-19 05:28:05,"Delhi, India",Ryanthetemp59,Positive,Pricing
What do they serve in that??,3,2024-11-19 08:25:04,"Bangalore, India",bforbakar,Neutral,Customer Service
Weird,2,2024-11-19 10:38:11,"Bangalore, India",Tanyaxunicorn,Negative,Overall Experience
"Is this you on twitter 
https://x.com/nitish_an/status/1858411940755993002?s=46",3,2024-11-19 11:33:32,"Delhi, India",busydoingnothing85,Neutral,Overall Experience
They are cooking meth over there.,3,2024-11-19 18:31:40,"Hyderabad, India",Lonely-Carpenter-147,Neutral,Delivery Speed
Money laundering or drugs,3,2024-11-19 18:39:56,"Chennai, India",Quiet-Elk8794,Neutral,Customer Service
wow people are crazy,2,2024-11-20 05:49:54,"Mumbai, India",Anonymous,Negative,Pricing
"This could be shady, or a good marketing strategy for the restaurant. God knows what they are up to!",5,2024-11-20 09:18:22,"Chennai, India",Some_Piece_8270,Positive,Pricing
All of the restaurants have same location on google maps.,3,2024-11-20 11:09:16,"Bangalore, India",NewToEverything199,Neutral,Pricing
"What filters did you use btw, will search if something similar exists in different cities",3,2024-11-20 12:47:52,"Mumbai, India",Forsaken_Site1027,Neutral,Delivery Speed
Aisa laga stock hai...price badhta hi gaya...badhta hi gaya.,3,2024-11-20 14:50:33,"Chennai, India",Voices-Say-Im-Funny,Neutral,Overall Experience
That’s a vape,3,2024-11-20 16:46:47,"Hyderabad, India",Few-Relationship202,Neutral,Customer Service
"I tried looking for these, I didn't find them. Any way you can share the links OP?",3,2024-11-20 17:32:06,"Bangalore, India",koala_on_a_treadmill,Neutral,Customer Service
Bhai nayagaon mei Maal bohot milte hy yaar,3,2024-11-21 01:16:17,"Bangalore, India",Anonymous,Neutral,Customer Service
"Update!! Zomato banned them 

https://www.livemint.com/companies/news/zomato-delists-fraud-single-dish-restaurant-after-social-media-users-suspect-shady-business-practices/amp-11732122581936.html",3,2024-11-21 02:35:52,"Mumbai, India",No_External4395,Neutral,Pricing
"If this tastes sour, I'm payin

It's the only pink thing I can afford",2,2024-11-21 06:18:13,"Chennai, India",Decent_Edge_4917,Negative,Pricing
Operates from Nayagaon. Quite possible,3,2024-11-21 19:21:57,"Chennai, India",raptor_210,Neutral,Customer Service
its chandigarh. probably drugs.,3,2024-11-17 10:54:34,"Mumbai, India",MaiAgarKahoon,Neutral,Customer Service
It's Punjab people. It'll definitely be drugs,3,2024-11-17 16:05:06,"Bangalore, India",Sun1385In,Neutral,Delivery Speed
bhai apna kaam karo na,3,2024-11-17 12:11:51,"Chennai, India",cosmicsom,Neutral,Overall Experience
This feels like the closest answer,3,2024-11-17 10:56:40,"Bangalore, India",enginTeuz,Neutral,Pricing
"True.

I know of an exact such operation in another city, that essentially sells vape pens/cartridges.
The price is almost the same, ₹1000-₹1200 per item.",5,2024-11-17 12:37:10,"Bangalore, India",iwannaberockstar,Positive,Customer Service
But why only the one item listed ?,3,2024-11-17 13:13:08,"Delhi, India",Critical_Prompt_1529,Neutral,Overall Experience
Vape juices are so costly in India?,3,2024-11-17 19:07:42,"Hyderabad, India",Nj1437,Neutral,Overall Experience
👆,3,2024-11-17 12:17:47,"Delhi, India",El_Impresionante,Neutral,Customer Service
Damn ur smart ... Or maybe just a heavy vaper xD,5,2024-11-18 07:28:52,"Delhi, India",yeeyeeassnyeagga,Positive,Pricing
https://x.com/nitish_an/status/1858411940755993002?s=46,3,2024-11-18 08:15:21,"Bangalore, India",torinotor,Neutral,Customer Service
BCF - Bull City Flavours is one of the commonly preferred brands.,2,2024-11-19 11:00:59,"Bangalore, India",pigeon_from_airport,Negative,Delivery Speed
"Damn, should be reported then",3,2024-11-17 17:11:34,"Mumbai, India",iamGobi,Neutral,Pricing
BHB is a gym supplement. ( third post juice BHB),3,2024-11-17 13:27:33,"Delhi, India",viksi,Neutral,Overall Experience
"That's because you have to put a custom code in the request section to get your ""food"". This is definitely a drug business and it'll pop-up tomorrow.",3,2024-11-17 20:55:00,"Hyderabad, India",SwimProZ,Neutral,Food Quality
Put it in update,3,2024-11-17 15:34:44,"Hyderabad, India",Plastic-Kiwi-1063,Neutral,Delivery Speed
Now they have your address,3,2024-11-18 06:53:20,"Mumbai, India",Fire_Tide,Neutral,Food Quality
report it to the police,3,2024-11-18 04:31:12,"Mumbai, India",Ok-Illustrator-6355,Neutral,Pricing
Too old idea . Read about Varalaxmi tiffin case . And you will realise how drugs are smuggled through Zomato/swiggy (even without them knowing ),5,2024-11-19 01:27:38,"Mumbai, India",Ok_Unit9864,Positive,Delivery Speed
did you put your address on their OP?,3,2024-11-19 11:09:32,"Mumbai, India",legobrick11,Neutral,Customer Service
https://preview.redd.it/jb9bj6qy0l1e1.png?width=1440&format=pjpg&auto=webp&s=8672ee31df30c27e5d7540786b3e972ffddcb5d3,3,2024-11-18 03:48:30,"Mumbai, India",rohithkumarsp,Neutral,Overall Experience
For research,3,2024-11-17 15:10:24,"Mumbai, India",Funnybreeze66,Neutral,Food Quality
Why give away your address if you feel it's shady?,2,2024-11-17 21:53:03,"Delhi, India",AcceptablePenalty483,Negative,Delivery Speed
"Why not?any particular reason 

I'm just curious to know",5,2024-11-17 11:03:02,"Mumbai, India",david005_,Positive,Pricing
"It’s the same owner. 

Cloud kitchen with different brand names.",3,2024-11-17 11:42:12,"Delhi, India",Wonderfonder,Neutral,Overall Experience
I don't think so. Swiggy/Zomato also charges a 20% or so commission to the restaurant on top of delivery fee paid by the customer.,5,2024-11-17 10:37:19,"Hyderabad, India",putin_putin_putin,Positive,Pricing
Definitely drugs,3,2024-11-17 10:18:45,"Mumbai, India",Annoying_Bunny95,Neutral,Overall Experience
Bhai drugs itne saste nahi aate,3,2024-11-17 18:34:16,"Delhi, India",bhoola_bhatka,Neutral,Overall Experience
Who is ordering drugs online and in india lol.. must be some stupid people.,5,2024-11-17 15:31:32,"Mumbai, India",Anonymous,Positive,Pricing
r/oddlyspecific,3,2024-11-17 12:42:06,"Bangalore, India",GreenBasi,Neutral,Overall Experience
Because the first thing is named Naughty Strawberry ?,5,2024-11-17 14:18:49,"Chennai, India",darkneel,Positive,Delivery Speed
Yeah same. Reads more like prostitution.,5,2024-11-17 12:33:47,"Delhi, India",NarealChutney,Positive,Pricing
Can't be so cheap no?,5,2024-11-18 03:24:41,"Hyderabad, India",Diligent_Speak,Positive,Customer Service
That was my first guess too.,5,2024-11-17 21:42:29,"Delhi, India",NocturnalEndymion,Positive,Customer Service
seems more like a vape thing w the flavours on display,5,2024-11-17 12:02:46,"Mumbai, India",shreyas-malhotra,Positive,Food Quality
Can you explain how money can be laundered by listing one exorbitant priced item,3,2024-11-17 10:25:08,"Bangalore, India",babathepower,Neutral,Customer Service
GST dega hawala pe?,3,2024-11-17 17:58:52,"Mumbai, India",Candid_Assistance935,Neutral,Customer Service
https://x.com/nitish_an/status/1858411940755993002?s=46,3,2024-11-18 08:15:56,"Mumbai, India",torinotor,Neutral,Pricing
"That'd be the cheapest baby powder with a pinch of cocaine i ever saw.

I expect shitty weed.

@OP, you got a btc wallet? Im dying to find out what they really deliver",5,2024-11-17 10:47:23,"Hyderabad, India",ranker2241,Positive,Overall Experience
what you ordering from kerala mess,2,2024-11-17 14:06:13,"Hyderabad, India",DudeWhereIsMyCoffee,Negative,Overall Experience
Remindme! 2 hours,3,2024-11-17 11:49:54,"Chennai, India",Careless-Dirt-5926,Neutral,Delivery Speed
Lad what's the status?,3,2024-11-17 13:58:36,"Hyderabad, India",Arena-Grenade,Neutral,Delivery Speed
so? any updates? or did you not go?,3,2024-11-17 14:10:22,"Chennai, India",Careless-Dirt-5926,Neutral,Food Quality
Haha thanks! I don’t think I’ll be falling short of 100rs,5,2024-11-17 11:27:57,"Bangalore, India",torinotor,Positive,Overall Experience
I need help in making this big 🙃,3,2024-11-17 20:48:13,"Hyderabad, India",torinotor,Neutral,Delivery Speed
"you can only see ratings, not reviews ig",3,2024-11-17 11:39:57,"Delhi, India",sauravkrx,Neutral,Overall Experience
Delivery personnel gonna bring the sex workers in their bags? 😭,3,2024-11-17 10:44:48,"Bangalore, India",a_rousedpanda,Neutral,Customer Service
I thought the same !!,3,2024-11-18 07:13:05,"Mumbai, India",Excellent_Salt2371,Neutral,Customer Service
"https://x.com/nitish_an/status/1858407483682779178?s=46

Bump this up mate",3,2024-11-18 07:11:47,"Chennai, India",torinotor,Neutral,Customer Service
Yup,3,2024-11-19 13:37:19,"Bangalore, India",torinotor,Neutral,Food Quality
"so ""normal"" people avoid",5,2024-11-17 16:20:27,"Chennai, India",pimlonpun,Positive,Food Quality
Yeah. It's not legal so it's grey market pricing..,2,2024-11-18 04:55:45,"Delhi, India",Melodic-Economist114,Negative,Overall Experience
Damn drugs dilevery from zomato? 😂,3,2024-11-18 03:41:42,"Mumbai, India",Uglyniguh,Neutral,Overall Experience
Absolutely one hundred percent. Selling hybrids or acids,5,2024-11-20 03:25:50,"Hyderabad, India",Digest_it-,Positive,Food Quality
"Yo how do you know? Have you tried ordering?? 
Genuinely asking",5,2024-11-30 19:15:21,"Mumbai, India",helluhelluu,Positive,Overall Experience
Im staying at a hotel so it shouldn’t be a problem 😄,3,2024-11-18 07:17:10,"Delhi, India",torinotor,Neutral,Delivery Speed
I doubt it unless they are working in Kahoot with zomato delivery people,3,2024-11-18 10:21:44,"Hyderabad, India",Federal_Equipment578,Neutral,Food Quality
https://x.com/nitish_an/status/1858411940755993002?s=46,3,2024-11-18 08:15:31,"Mumbai, India",torinotor,Neutral,Customer Service
They probably ask to be bombed so that they don't get recommended,3,2024-11-18 04:21:39,"Mumbai, India",risheeb1002,Neutral,Delivery Speed
That’s rice from tikka times and im pretty sure of that as i have eaten it many times,5,2024-11-18 14:23:30,"Chennai, India",Heaven_Supremelord,Positive,Pricing
For Science,3,2024-11-18 02:46:14,"Bangalore, India",6packBeerBelly,Neutral,Customer Service
Other methods exist where you won't have to pay such a high commission.,5,2024-11-17 11:12:55,"Delhi, India",v00123,Positive,Overall Experience
Most probably drugs,5,2024-11-17 11:52:16,"Bangalore, India",Snowy-HandJob,Positive,Pricing
aren't cloud kitchen's.....supposed to y'know sell food?,3,2024-11-17 14:16:02,"Mumbai, India",NicePositive7562,Neutral,Overall Experience
Same google maps location as well.,3,2024-11-20 11:10:27,"Delhi, India",NewToEverything199,Neutral,Overall Experience
A small price for the safety of the business.,2,2024-11-17 10:50:27,"Delhi, India",directionless_force,Negative,Overall Experience
mules also take cut and are risk to owner.,3,2024-11-17 10:59:33,"Hyderabad, India",sunil100k,Neutral,Food Quality
thats a modest delivery fees for drugs.,5,2024-11-18 05:04:24,"Delhi, India",ElectricalAd3189,Positive,Customer Service
"Could be, the restaurant would also only agree to orders done by their clients or something similar so no one else gets the stuff.",3,2024-11-17 11:57:19,"Delhi, India",whatyouthinkisfake,Neutral,Pricing
🤫🤫🤫,3,2024-11-17 13:12:19,"Chennai, India",LordVillageHoe,Neutral,Overall Experience
"Just advance amount, cover charges",3,2024-11-18 05:22:28,"Delhi, India",hydiBiryani,Neutral,Customer Service
You underestimate people.,3,2024-11-18 05:51:41,"Delhi, India",YetSomeRandom,Neutral,Overall Experience
LMAOOooo,3,2024-11-17 10:26:47,"Hyderabad, India",Ilinkthereforeiam2,Neutral,Delivery Speed
Here's Saul Goodman explaining this - https://youtu.be/RhsUHDJ0BFM?si=p_3KsdPfANaT1LSa,3,2024-11-17 10:37:34,"Chennai, India",Chakravartin_Arya,Neutral,Food Quality
True I also got curious by laundering word. ,5,2024-11-17 10:31:12,"Hyderabad, India",One_Ostrich_3014,Positive,Delivery Speed
Cash on Delivery ?,3,2024-11-17 10:43:11,"Delhi, India",_snorlax__,Neutral,Food Quality
Wow! Okay let me try to create one,5,2024-11-17 11:26:04,"Bangalore, India",torinotor,Positive,Customer Service
"I mean if 9 other people are willing to spend ( waste ? ) 100 , you can order on our behalf just because of the curiosity",2,2024-11-17 11:43:23,"Bangalore, India",Palmar_Aponeurosis,Negative,Pricing
Let’s go sir,3,2024-11-17 20:50:09,"Hyderabad, India",The_Indian_News,Neutral,Overall Experience
[deleted],3,2024-11-17 14:59:27,"Chennai, India",Anonymous,Neutral,Delivery Speed
Lmao,5,2024-11-17 11:15:20,"Hyderabad, India",bakshaa,Positive,Overall Experience
"Please edit your post to mention this at the end, let’s get this the attention it deserves. Also tag Chandigarh Police maybe.",3,2024-11-18 07:20:13,"Mumbai, India",NoZombie2069,Neutral,Food Quality
Digital India,3,2024-11-18 08:12:15,"Delhi, India",Sahashraanshu,Neutral,Customer Service
For a friend,3,2024-11-18 18:37:59,"Mumbai, India",Inevitable_Garlic259,Neutral,Overall Experience
found Saul Goodman's reddit account,3,2024-11-17 17:14:00,"Mumbai, India",le_shivas,Neutral,Pricing
This guy launders,3,2024-11-17 15:59:07,"Chennai, India",krishna_rolly,Neutral,Customer Service
Why can’t it be yours only ?,3,2024-11-17 19:09:44,"Chennai, India",The_Indian_News,Neutral,Overall Experience
Or girls (russian),3,2024-11-18 07:16:53,"Hyderabad, India",Adventurous_Fox867,Neutral,Pricing
These ones are cooking Meth.,3,2024-11-18 03:23:35,"Delhi, India",Diligent_Speak,Neutral,Customer Service
"Nah man, it's gotta be drugs! Why? Because I had the exact same idea of selling drugs when I first ordered food online years ago, lol!",5,2024-11-17 12:07:17,"Chennai, India",Annoying_Bunny95,Positive,Customer Service
"Only caveat being, swiggy will give you 1000, not 1500. 30% commission",3,2024-11-17 10:56:22,"Delhi, India",SiriusLeeSam,Neutral,Food Quality
Accurate.,5,2024-11-17 10:51:23,"Chennai, India",directionless_force,Positive,Delivery Speed
Nice u have to make just 666 order on Zomato for showing 10 lakh is legit legal,5,2024-11-17 12:04:49,"Mumbai, India",ConfidentForm5487,Positive,Food Quality
